{
  "packId": "en-core-1m",
  "language": "en",
  "version": 1,
  "createdAt": "2026-02-09T00:00:00Z",
  "recordCount": 1000000,
  "description": "Doompedia EN pack with summary cards.",
  "packTags": ["science", "history", "biography"],
  "compression": "none",
  "shards": [
    {
      "id": "shard-0001",
      "url": "https://cdn.example.org/en-core-1m/shard-0001.ndjson",
      "sha256": "aaaaaaaaaaaaaaaaaaaaaaaaaaaaaaaaaaaaaaaaaaaaaaaaaaaaaaaaaaaaaaaa",
      "records": 40000,
      "bytes": 19328401
    }
  ],
  "delta": {
    "baseVersion": 1,
    "targetVersion": 2,
    "url": "https://cdn.example.org/en-core-1m/delta-1-2.ndjson",
    "sha256": "bbbbbbbbbbbbbbbbbbbbbbbbbbbbbbbbbbbbbbbbbbbbbbbbbbbbbbbbbbbbbbbb",
    "ops": 13842
  },
  "topicDistribution": {
    "science": 240000,
    "history": 180000
  },
  "entityDistribution": {
    "person": 290000,
    "place": 210000,
    "concept": 500000
  },
  "sampleKeywords": ["science", "history", "biography", "geography", "technology"],
  "attribution": {
    "source": "Wikipedia content snapshots",
    "license": "CC BY-SA 4.0",
    "licenseUrl": "https://creativecommons.org/licenses/by-sa/4.0/",
    "requiredNotice": "Wikipedia is a trademark of the Wikimedia Foundation."
  }
}
